job_id,title,company,location,url,description,email,phone,salary,resume_filename,coverletter_filename,Applied,Application Date,Questions
85075484,Senior Software Developer,Robert Walters,Perth WA,https://www.seek.com.au/job/85075484?type=standard&ref=search-standalone&origin=cardTitle#sol=d29034aa174feaa6259a6c02d7c97be47d99a33a,"An exciting opportunity has arisen for a Senior Software Developer to join a forward-thinking institution in South Perth, where technology is at the heart of strategic growth and innovation. This role offers you the chance to be part of a team that is making significant investments in Information and Technology Services, supporting new models of teaching and research through robust, flexible, and integrated enterprise solutions.
Enjoy flexible working opportunities that support your work-life balance while contributing to impactful projects within a leading educational environment.
Be part of an organisation investing heavily in technology advancement, offering you exposure to cutting-edge tools and methodologies across the full software development lifecycle.
Benefit from a collaborative culture that values knowledge sharing, professional growth, and the delivery of innovative solutions aligned with best practices.
What you'll do:
As a Senior Software Developer based in South Perth, you will play a pivotal role in shaping the technological landscape of a renowned institution. Your day-to-day activities will involve engaging with stakeholders to understand their requirements deeply before translating these into well-architected software solutions. You will be responsible for designing and implementing both front-end interfaces and complex integrations with back-end systems using a broad range of programming languages and frameworks. By championing agile practices and leveraging Azure DevOps tools, you will help drive efficiency across multiple projects while maintaining high standards of quality. Your leadership will extend beyond technical delivery as you mentor colleagues and contribute actively to continuous improvement efforts. Success in this role means not only delivering reliable software but also enhancing the overall capability of the team through knowledge sharing and collaborative problem-solving.
Collaborate closely with internal business customers to elicit detailed software requirements and ensure alignment with organisational objectives.
Design, build, test, support, and document robust software solutions that adhere to internal standards and industry best practices.
Lead initiatives across the full software development lifecycle, ensuring quality outcomes from conception through deployment and ongoing maintenance.
Drive continuous improvement by identifying opportunities to enhance existing systems and processes within both business-as-usual operations and project delivery.
Integrate front-end web technologies with back-end systems using your expertise in PL/SQL, Java, HTML, Javascript, CSS3, XML, Bootstrap, Jquery, ANSI SQL, REST APIs, C#, .NET and related frameworks.
Champion agile methodologies and utilise Azure DevOps tools to streamline workflows and foster effective collaboration within cross-functional teams.
Provide mentorship and guidance to junior developers, fostering a culture of learning and shared success within the team.
Ensure all solutions are scalable, secure, and maintainable by adhering to rigorous documentation standards throughout the development process.
Engage proactively in stakeholder communication to manage expectations and deliver solutions that meet evolving business needs.
What you bring:
To excel as a Senior Software Developer in this role, you will bring substantial experience working on complex projects involving both front-end web technologies and back-end integrations. Your background should include hands-on involvement throughout all phases of the SDLC-preferably within environments that value agile approaches-and familiarity with modern toolchains like Azure DevOps. You will have demonstrated your ability to translate business requirements into scalable technical solutions while maintaining clear communication with stakeholders. Your approach should reflect a commitment to best practices in coding standards as well as an enthusiasm for mentoring others within your team. A willingness to embrace new challenges alongside strong analytical thinking will set you apart as someone who can contribute meaningfully not just through technical delivery but also by nurturing a positive team culture.
A relevant tertiary qualification or equivalent competency demonstrating your commitment to professional excellence in software development.
Comprehensive technical knowledge across programming languages such as Java, jDeveloper, HTML, Javascript, CSS3, XML, Bootstrap, Jquery, ANSI SQL, REST APIs, C# and .NET frameworks.
Proven experience with PL/SQL for database-driven applications as well as integration expertise between diverse systems.
Familiarity with Apex forms development is highly desirable for candidates looking to broaden their skillset within this environment.
Deep understanding of the entire software development lifecycle (SDLC), including hands-on experience with Agile methodologies and Azure DevOps toolsets.
Demonstrated ability to provide leadership within technical teams by guiding design decisions for enterprise-grade solutions.
Strong interpersonal skills enabling effective collaboration with stakeholders at all levels of the organisation.
A track record of driving continuous improvement initiatives that enhance system performance or streamline operational processes.
Excellent written documentation skills ensuring clarity in solution design and ongoing system maintenance.
What sets this company apart:
This institution stands out for its unwavering commitment to leveraging technology as a catalyst for educational excellence. Significant investments are being made into Information and Technology Services-not only supporting current operations but also paving the way for future advancements in teaching and research. Employees benefit from an inclusive workplace culture that prioritises flexibility in working arrangements alongside opportunities for professional growth. The organisation's focus on robust enterprise architecture ensures that every team member has access to state-of-the-art tools while enjoying the support of knowledgeable colleagues who value collaboration over competition. Here you will find an environment where your contributions are recognised as vital to achieving broader strategic goals-making it an ideal setting for those seeking both challenge and fulfilment in their careers.
Aboriginal and Torres Strait Islander Peoples are encouraged to apply.
To apply please click apply or call Milena Wawrzyniak-Kalyanpur on +61 8 9266 0980 for a confidential discussion.",,,,Confidential_resume.pdf,Confidential_coverletter.pdf,,,
84939068,Back End Developers (Multiple) - Contract - Perth,"Talent – Specialists in tech, transformation & beyond",Perth WA,https://www.seek.com.au/job/84939068?type=standard&ref=search-standalone&origin=cardTitle#sol=1eacfa7742c44a9434cb2f13b30259880047c3f5,"My client, a major player in the mining industry, is seeking multiple Senior Back-End Developers for an exciting 12-month contract. These roles are part of a cross-functional development team delivering the next generation of fleet management and autonomy solutions-powering automated dispatch, precision machine guidance, and control of autonomous vehicles.
You'll be designing and developing scalable backend systems as part of a complex, distributed platform that spans data centres, control systems, and onboard vehicle hardware. You'll also have the opportunity to mentor junior developers and help shape technical direction within your squad.
Key Responsibilities:
Design and build backend services and APIs that meet functional and non-functional requirements.
Own complex stories from design through to deployment.
Participate in design reviews and contribute to architectural decisions.
Write clean, testable, well-documented code.
Improve codebase maintainability through refactoring and better observability.
Mentor junior developers and promote best practices in software design and development.
Collaborate with domain experts to integrate shared frameworks and libraries.
Proactively raise technical risks and issues with Tech Leads.
Skills & Experience:
5+ years' experience in software development roles, ideally in complex, distributed environments.
Strong experience with C# .NET Core, Entity Framework, RabbitMQ, and SQL Server.
Skilled in unit testing and working in microservice architectures.
Experience with Docker or Kubernetes for containerisation.
Familiarity with Linux systems and Akka.NET is desirable.
Personal Attributes:
Proactive and solutions-focused with a passion for clean code.
Adaptable to changing priorities and thrives under pressure.
A collaborative mindset with a strong sense of accountability and technical leadership.
These are high-impact roles where your work will directly contribute to cutting-edge automation within the mining industry. If you're ready to join a team pushing the boundaries of mining technology, we'd love to hear from you.
If you match the selection criteria and are interested please apply by clicking the ""APPLY NOW"" button. Any further questions For a list of all vacant positions, please see our website www.talentinternational.com
For further enquires please contact Alice on 08 6212 5598",,08 6212 5598,,MiningIndustryLeader_resume.pdf,MiningIndustryLeader_coverletter.pdf,,,
84900249,Junior Recruitment Consultant,Verse Group,Perth WA,https://www.seek.com.au/job/84900249?type=standard&ref=search-standalone&origin=cardTitle#sol=5cdb9cc6227fd8d950bd6b62627352ec092de74e,"About the Role
We’re on the lookout for a driven and people-focused Junior Recruitment Consultant to join our growing Applications recruitment team at Verse, a Perth-based tech recruitment agency.
This is an entry-level position where you'll help find and speak with talented IT professionals like Software Developers, Testers and Data Analysts. You’ll be supporting experienced recruiters by identifying great candidates and helping match them with roles across some of Perth’s top tech teams.
If you’re curious about the tech industry, enjoy speaking with people and want to build a long-term career in recruitment, this is a great place to start.
You Should Have
A background in retail, marketing, advertising, commerce or similar
Strong written and verbal communication skills
An interest in people, careers and the tech industry
Willingness to learn and motivation to grow
Confidence speaking on the phone and meeting new people
Nice to Have
Some experience using LinkedIn or admin systems
Exposure to recruitment, HR or tech
Key Responsibilities
Search for quality candidates using online tools
Call and meet candidates to understand their experience and career goals
Write clear notes and summaries to support the team
Work closely with consultants to help fill live roles
Build your knowledge of the local tech market
The Benefits
Clear pathway for career progression into consultant roles
Ongoing training and mentoring from experienced team members
Friendly and supportive CBD office environment
Casual dress code and relaxed team culture
Work from home every Wednesday
How to Apply
If this opportunity resonates with you, please apply. For further details or enquiries, feel free to reach out directly via email at matthew@versegroup.com.au or call Matthew Burke on (08) 6146 4466.",matthew@versegroup.com.au,,,Verse_resume.pdf,Verse_coverletter.pdf,,,
84953017,Principal Software Engineer (cloud native),Clinical Innovation Systems Pty Ltd,Perth WA,https://www.seek.com.au/job/84953017?type=standard&ref=search-standalone&origin=cardTitle#sol=8829ab7f8f8b2f3119ef84518594153dfb46aca2,"Join our innovative healthcare (cloud-first) company to build AI-enhanced functionality on AWS, with kubernetes scalability; work from home, flexible hours.
·        AWS, kubernetes, microservices
·        Expanding Australian healthcare SaaS company
·        Flexible working arrangements
About CRiS Care
CRiS Care is an Australian company servicing the healthcare industry (primarily hospitals and medical facilities) with cloud-based patient care capabilities. This includes managing tests, as well as facilitating clinical assessments (structured, dictated or ambient-listening AI), and providing a platform for seamless clinical care across the facility.
Position Description & Responsibilities
As Principal Software Engineer with CRiS Care, you will be leading a small team of engineers to architect, build and maintain cloud-based microservices and Angular web UI’s for CRiS Care web applications.
You will be leading the technical team, and reporting to CRiS Care’s board of Directors.
While technical ability is important, the capacity to rapidly learn new technologies and the ability to collaborate in a small team in a dynamic environment is paramount. We are looking for a team player, based in Australia.
As you will be involved in safeguarding personal healthcare information, we will require contactable references, background checks and signed acceptance of our company Information Security Policy.
Personal Attributes
·        Excellent English
·        Outcomes-focussed
·        Good communicator and ability to work within a team
·        Adept at learning new skills & technologies
·        Adept at scoping, planning, and prioritising tasks
Experience, Skills and Technologies
Mandatory criteria
1.        At least 5 years of full-time software development experience (employment or contracting)
2.        Have designed and implemented distributed systems
3.        At least 12 months experience with Kotlin (or Java)
Desirable proficiencies
1.        Qualifications in Computer Science
2.        Spring Boot (REST and GraphQL APIs)
3.        Experience in DevOps (Docker, Kubernetes, Terraform, AWS)
4.        Event-sourcing data models
5.        SQL (MySQL, Liquibase)
6.        Cyber-security principles
7.        HL7 integrations (Mirth Connect)
8.        Familiarity with Artificial Intelligence tools and services
9.        Previous experience in the domain of healthcare
10.  Angular (or other SPA frameworks)
Demonstrable attributes
A brief technical task (coding challenge) may be required prior to interview, for submission within a short time-frame (1-2 days).
Interview questions will be centred around:
·        Experience & technologies
·        Teamwork & collaboration (examples)
·        Communication & conflict resolution (examples)
·        Problem-solving and solution planning (on the spot challenge)
Remuneration
Options include full-time employment or full-time contracting (at an hourly rate), with remuneration based on experience and capability. Initial 12-week probation period applies with no guarantee of ongoing contract; on successful completion of probation period and by mutual agreement thereafter, ongoing contract of 6 or 12 months may be offered, based on the successful applicant’s preference. Workplace arrangement is for remote service, tracking actual hours worked - working from home, or a co-working space. Target salary will be in the range of 120-180k per annum.
Please note: Successful candidate must have full working rights to work in Australia. Unfortunately, we are unable to sponsor visas for overseas candidates at this stage.
CRiS Care does not accept unsolicited resumes from recruitment agencies and search firms. Please do not email or send unsolicited resumes to any CRiS Care employee, location or address. CRiS Care is not responsible for any fees related to unsolicited resumes.",,,120-180k per annum,CrisCare_resume.pdf,CrisCare_coverletter.pdf,,,
85016784,Senior Full Stack Engineer,HEALTHENGINE,Perth WA,https://www.seek.com.au/job/85016784?type=standard&ref=search-standalone&origin=cardTitle#sol=3fb1fdc53178fe31b6fbbc291d3fc73d970ccfe4,"Company Description
This is your opportunity to join our team of forward-thinking, change-making individuals. Operating at the intersection of health and tech, you'll help us shape the future of healthcare. 
Our Mission
Healthengine’s mission is to improve access to healthcare by helping Australians find and connect with all primary care providers. We strive to achieve this through Australia’s leading healthcare marketplace, bringing together over 4 million active Australians, and more than 10 thousand practitioners that are powered by our technology - and growing.
We’re all patients, right? So, it’s easy to get behind a mission that seeks to improve the healthcare experience for all Australians.
Job Description
The Gig
As our newest Senior Full Stack Engineer, you will help to build, maintain & support the Healthengine website & microservices as part of the larger development team. You’ll have a well rounded team backing you, including product manager, designer and marketing manager, while a high level of autonomy will provide plenty of opportunity to expand your own skillset.
Responsibilities:
Work as part of a product team to deliver high-quality and high-performing experiences to hundreds of thousands of users
Collaborate with other developers and designers to come up with innovative and delight-filled solutions
Implement ideas to help increase developer velocity and better user experiences
Implements functionality across the entire technical stack adhering to standards established and agreed to by the front and back-end guilds
Break down user stories into technical tasks, and plan areas of future technical work for the team
Contribute to common code bases and standards for the team
Play a valued role in the hiring process and mentor junior/mid-level engineers
About You
You're the kind of person who takes accountability in a fast-paced, autonomous and flexible environment. Fast may be your default (like us!) but you never, ever compromise on what’s important, willing to take a steady, more informed approach when it comes to maintaining the trust of our team and customers. You handle change like a pro, and continuous improvement is a way of life. You are not afraid to speak up and share your thoughts respectfully, with the intention of making positive change. You take initiative and drive your own learning journey without waiting for someone to point you in the right direction. And ultimately, you care: about people, health and innovation. 
For this role, you’re someone who’s dabbled in AI and has probably even tried to implement something with it to see what all the fuss is about—bringing that curiosity and forward-thinking edge into your work.
Experience you’ll bring:
Strong understanding of at least one JavaScript framework (React preferred)
Strong understanding of PHP (or strong experience in a similar language)
Strong understanding of Postgres (or other relational databases)
Ideally experienced in AWS infrastructure 
Ideally experienced in Agile development methodologies (Kanban/Scrum)
Additional Information
The perks behind the work
Healthengine is where you’ll be your best self. You’ll collaborate with smart, interesting people who will challenge you to be better. You will learn a lot and grow even more. Healthengine is the ideal workplace to bring ideas, make change and leave a lasting impact on your team and the industry. 
In addition to an array of growth opportunities, we also offer:
A hybrid workplace that offers flexibility to balance work and life
A vibrant social calendar of events, quarterly team-building activities and more
Unlimited coffee and snacks, and a subsidised vending machine in our Perth office 
Awesome discounts and salary packaging options through our benefit partner, Maxxia
Access to learning resources to develop your personal and professional skills 
Workplace wellness program, including extra leave and access to EAP and other wellbeing resources
Extra leave so you can recharge and focus on your wellbeing 
Support for you when it comes time to grow your family with paid parental leave
We're proud to share that Healthengine ranked 13th Best Workplace in Technology 2023 and are a certified Great Place to Work in Australia 2025/26.
Diversity and inclusion
At Healthengine, we believe in the power of a diverse work environment to fulfil our mission and better serve our providers and patients. We’ve created a culture that genuinely values diverse perspectives and backgrounds, knowing that our differences can inspire new ideas. We are fully committed to building and maintaining our inclusive environment where all voices are respected and heard. If you think you have what it takes but don't check all the boxes, reach out anyway - we’d love to hear from you.",,,,Healthengine_resume.pdf,Healthengine_coverletter.pdf,,,
85102133,Junior Project Engineer,Delmar Systems Australia pty Ltd,Perth WA,https://www.seek.com.au/job/85102133?type=standard&ref=search-standalone&origin=cardTitle#sol=ca4e02cd34fbd94ea78494b9d9f22b302b23f784,"Delmar Systems, the industry leader in temporary and permanent offshore mooring services is a worldwide supplier of offshore mooring-related services including engineering design, mooring analysis, project management, planning and procedures, operational installation, and mooring equipment rentals. We are committed to creating a strong future for the global energy industry and beyond by developing both equipment and processes that are safe, effective, and cost-efficient.
Our APAC team is looking for a Junior Project Engineer to join our team on a full-time basis.
In Delmar, each employee is empowered with the knowledge to create unparalleled solutions with our sophisticated technology.
 About the role:
The Junior Project Engineer reports directly to the Technical Manager and works closely with Engineering and Operations Team to offer technical and engineering support and timely delivery of engineering documentation. This role will suit a motivated team-player with previous project engineering / project management and naval architect engineering experience within the energy industry.
 Benefits:
Delmar Systems is a fast-growing company with a lot of potential. We are looking for someone who can help us grow even more. Your role will be pivotal to our short-term success and provide future opportunities to manage our expansion. Therefore, we offer job security and a competitive salary. Additionally, we offer flexible work hours, company provided laptop and phone, home internet, private health insurance and gym membership,
 Responsibilities include but not limited to:
Performing hydrodynamic and motion analyses on offshore structures including semi-submersibles, FPSO, floating offshore wind turbines
Performing quantitative / qualitative risk assessments of mooring designs
Preparations of engineering reports and operational procedures
Develop and review operational procedures, drawings pertaining to mooring operations
Preparation of equipment list for mobilisation offshore and assisting with tracking of equipment throughout project
Offshore Attendance for Prelay Installation/Recovery and Rig Move Operations
 Qualifications and Experience:
Degree level in relevant engineering discipline, [Naval Architecture is preferred]
2+ experience in a similar role (preferred)
Knowledge and experience with mooring and foundation will be highly regarded
Experience with Engineering software (GMOOR, Orcaflex, AQWA)
Experience with mooring system designs
Experience with offshore operations
 Skills and Knowledge
Excellent verbal and written communication skills
Working knowledge of relevant codes and standards in particular API RP 2SK and DNV-OS-E301.
Proficient in MS Office packages (including Excel, Project and Power BI)
Excellent planning and organisational skills
Creative problem-solving approach and a critical thinker
Accuracy and attention to detail
Ability to work within a dynamic environment with tight deadlines
Flexible and pro-active attitude to work
Working towards chartership (Engineers Australia, RINA or other professional bodies)
 This is an exceptional opportunity to shape and develop an important function within a professional and dynamic business.
The role is Perth-based with the chance to travel nationally and internationally.
Must have full working rights in Australia, Permanent Residency or Australian citizenship to be considered for this role.
If you meet the criteria and are interested in joining the Delmar Team, please apply through the link by the 23rd of July 2025. Delmar reserves the right to edit or remove this advertisement before the advertised date.",,,,DelmarSystems_resume.pdf,DelmarSystems_coverletter.pdf,,,
