job_id,title,company,location,url,description,email,phone,salary,resume_filename,coverletter_filename,Applied,Application Date,Questions
85181656,"3D Developer – Entry to Mid-Level | Perth, WA",Immersive Technologies,Osborne Park,https://www.seek.com.au/job/85181656?type=standard&ref=search-standalone&origin=cardTitle#sol=c8fa35d6e57afebbad71e135061d16754593f53f,"3D Developer – Entry to Mid-Level | Perth, WA
Immersive Technologies is on the lookout for a passionate and curious 3D Developer who’s eager to learn, grow, and make a real impact through innovative training solutions. If you’re someone who thrives in a collaborative environment, loves solving problems, and is excited by the idea of transforming complex ideas into engaging learning experiences — we’d love to hear from you.
About Us
We’re a global leader in simulator-based training solutions for the mining industry. Our commitment to creating engaging and impactful training products sets us apart. Our team specializes in developing digital learning solutions — from real-time training environments and assets to complete VR applications — that change how mining professionals learn and perform in the field.
What We’re Looking For
We’re not necessarily after years of experience — we’re after the right mindset. If you’re adaptable, quick to learn, and excited to work in a niche space where innovation is key, you’ll fit right in.
You’ll be working with a friendly, talented, and supportive team that values collaboration and creativity.
Key Responsibilities
Modelling and texturing 3D assets for real-time rendering.
Contribute to the development of engaging 3D training products using tools like Unity.
Embrace feedback and continuously improve your skills and outputs.
Be able to work both independently and collaborate within a team environment to bring training concepts to life.
Managing project deliverables so that they meet minimum quality levels within deadlines.
What You Need to Know (Minimum Requirements):
A strong foundation in 3D modelling and UV unwrapping.
A solid grasp of various texturing techniques using industry standard software.
An eye for detail in hard surface modelling and real time environments.
Organisation skills, including efficient file management and version control.
Experience with: Unity, Substance Painter, Photoshop.
Bonus Points (Nice to Have, Not Must-Have):
Interest in scripting (Javascript or C#), animation, or video/audio production.
A background in game development, CGI, or digital media.
Why Join Us?
Work on meaningful projects that make a real-world impact.
Be part of a team that values learning, creativity, and collaboration.
Enjoy a supportive environment where your growth is a priority.
Competitive salary and benefits, flexible work environment and room to grow professionally.
If you’re a 3D Developer and are ready to bring your curiosity, creativity, and can-do attitude to a team that’s shaping the future of training in mining — apply now. We can’t wait to see what you’ll bring to the table.",,,,ImmersiveTechnologies_resume.pdf,ImmersiveTechnologies_coverletter.pdf,,,
84911720,C# Software Developer,Bin Manager,O'Connor,https://www.seek.com.au/job/84911720?type=standard&ref=search-standalone&origin=cardTitle#sol=914af51792a917182835c87f332a22b8b10b15d3,"BinManager is a dynamic and innovative software development company dedicated to delivering solutions to our clients. We specialize in the Waste Industry providing technologies that offer a range of easy to use solutions and pride ourselves on our commitment to quality, creativity, and customer satisfaction. 
Job Description: 
We are seeking to build an in-house team of talented individuals and are looking for an experienced .NET developer with mobile app development experience to join us. In this role you will be responsible for developing and maintaining a vertical market application and working with mobile applications, ensuring seamless integration and optimal performance across platforms.
As part of this role, there is also an opportunity for you to transition to a full stack web development role in the future.
Although we have been in business for several years, think of this as a start up getting in on the ground level and helping us build a team and products we are proud to work with.
Responsibilities: 
Design, develop, and deploy scalable and secure applications using front-end and back-end technologies. 
Create, maintain, and enhance current mobile applications whilst developing new ones.
Collaborate with designers, product managers, and other stakeholders to understand project requirements and deliver high-quality solutions.
Optimize application performance, troubleshoot issues, and implement enhancements as needed.
Stay updated on industry trends, best practices, and emerging technologies to continuously improve our development processes and offerings.
Requirements: 
This is an in-house position and you MUST reside in Perth WA. External to Perth, applicants need NOT apply as your application will NOT progress. 
Bachelor's degree in Computer Science, Engineering, or related field.
Strong English, written and verbal communication skills
Minimum 3 years of experience as a .NET Developer, Mobile App Developer, or similar role.
Strong proficiency in C#, WinForms, and Microsoft .NET framework
Strong back-end development skills
Experience developing cross-platform mobile applications using frameworks such as Flutter, React Native, or Xamarin/MAUI.
API development experience in REST, Web API or WCF/Web Services
Familiarity with database technologies such as MariaDB, Firebird, Microsoft SQL Server or MySQL.
Excellent problem-solving skills, attention to detail, and ability to work independently and collaboratively in a fast-paced environment.
Strongly desirable:
Experience with DevExpress
Experience with ORMs such as EF or Dapper
Web development experience with Angular or React
Experience with .NET Core
Benefits:
Flexible work hours
Professional development opportunities
Friendly and supportive team environment
How to Apply: If you're passionate about making a difference with your skills with software development and looking for an exciting opportunity to contribute to innovative projects, we'd love to hear from you! 
You must reside in Perth, office location is South of the river. Please submit your resume and a cover letter with photo highlighting your qualifications and relevant experience with references.",,,,Binmanager_resume.pdf,Binmanager_coverletter.pdf,,,
85066338,Data Engineer,CorePlan,Perth WA,https://www.seek.com.au/job/85066338?type=standard&ref=search-standalone&origin=cardTitle#sol=2636051f3f2ebffb89aa406ca91ce7bf5cf1cc8c,"Enjoy the flexibility of a hybrid role
Work in a vibrant office within the Perth CBD
Bring your deep technical expertise and work on customer integration initiatives!
🔍 About Us 
CorePlan isn’t your typical mining software company. We’re a Perth tech startup reimagining mining operations through our cutting-edge digital SaaS drilling management platform. We’ve replaced outdated paper and spreadsheets with a seamless solution winning customers worldwide.
Our mission? Advance the operation of digital drilling operations in mining. Our momentum? Growing fast.
We’re a high-performing team of execution-focused self-starters, building the next generation of software for mining.
💼 The Role
As a Data Engineer at CorePlan, you'll work as part of the engineering team with a special focus on customer integration initiatives. You'll bring deep technical expertise to work closely with our customer success and onboarding teams, serving as the technical bridge between our platform and our customers' existing systems to design and implement seamless data integrations.
🛠 Key Responsibilities
Design and implement custom data integration solutions for enterprise mining customers
Build and maintain robust ETL pipelines that connect customer systems to our platform
Write custom Python, Node.js, or shell scripts to handle complex data transformations
Manage data warehouse operations using Snowflake to support customer data needs
Partner with customer success teams to provide technical consultation during integration processes
Work closely with the core engineering team while focusing primarily on customer success and onboarding initiatives
Bring your technical engineering expertise to customer-facing teams during complex integration projects
Drive improvements in our integration tools and processes to enhance customer onboarding
Participate in client meetings to understand initiative objectives, underlying problems to solve and data requirements
🙌Qualifications and Fit
Have been working with Python and data pipelines for a few years in a production environment
Know your way around data warehouses like Snowflake, along with databases like PostgreSQL
Practical knowledge of ETL/ELT processes and data pipeline orchestration tools
Experience with API integrations, webhooks, and data streaming technologies
A strong grasp of cloud services like AWS, and have deployed data solutions there
Can write clean, maintainable scripts in Python, Node.js, and shell for automation
Experience with customer-facing technical roles or professional services
You have an analytical mind and a knack for troubleshooting complex data integration challenges
Strong communication skills, attention to detail and initiative along with a collaborative mindset
🎁 Perks & Benefits
Prime CBD location
Hybrid role with 1 day WFH 
Fun office culture – open plan space, birthday celebrations, team events (hello, movie nights + office jukebox!)
Parental leave top-up pay (covering the difference between the government’s minimum parental leave payment and your regular base salary) 
Access to EAP mental health & wellbeing services for you and immediate family members 
🚀 Ready for your next adventure?
If you're ready to bring your A-game to a tech-forward startup, click APPLY NOW to submit your CV and cover letter. Have questions? Reach out to us at careers@coreplan.io
🤝 Recruitment Agencies
We appreciate your hustle, but we’re not engaging agencies right now. Want to be on our radar for the future? Email careers@coreplan.io",careers@coreplan.io,,,Coreplan_resume.pdf,Coreplan_coverletter.pdf,,,
85266320,Principal Developer - Innovation and Solution,WA Health,Perth WA,https://www.seek.com.au/job/85266320?type=standard&ref=search-standalone&origin=cardTitle#sol=2706d214c716a0c8dff06ed5443823e5e4539bc5,"CRVCID. 682720
Hello, are you… An innovator? A problem solver? A team player? A customer focused thinker? Committed to helping others? Interested in contributing to the health of all Western Australians?
This is an exciting time for HSS and we’re looking for adaptable, motivated, and resilient people to join our growing team.
Before you read this job ad, please note, HSS can make reasonable adjustments to allow you to fully participate in the application and interview process. If this is relevant for you, please refer to the contact details under the ‘Application and Interview Support’ section of this job ad.
About HSS
As the Western Australian Government agency providing shared services to the state’s public health system, we provide a suite of financial, ICT, procurement and supply, and workforce services to more than 65,000 employees across WA’s public health services and hospitals.
Put simply, we work behind the scenes to ensure the WA health system runs smoothly.
Whether you work in our corporate offices, at our customers’ sites, or at our warehouses Boorda and Jindakoort located in Jandakot - we are one united team of over 1,500 people.
Our vision is to provide great services to our customers, be a valued partner, and support the health of all Western Australians. We seek to achieve this by delivering on our purpose of supporting our customers to provide excellent health care.
Find out more about us www.hss.health.wa.gov.au
Your new role
We are seeking an enthusiastic and suitably experienced person for the role of Principal Developer, Innovation and Solution.
This is a Recruitment Pool for Permanent, Full Time appointment(s).
As a member of ICT Applications, you will be responsible for:
Playing a senior role in the development of technical solutions for the implementation and support of specialised application software and interoperability.
Supervising of Application Development team resources required to provide effective and efficient delivery of quality ICT Application Services that meets customer expectations.
Providing innovative solutions and technical expertise on application development projects.
Please view the Job Description Form (JDF) attached which provides a full statement of duties for the position.
If you thrive in a fast paced, multifaceted working environment, and are eager to contribute to our purpose of supporting our customers to provide excellent health care, we would love to hear from you.
The role is WA based and any relocation costs will not be covered.
Why join our team
Be part of an organisation that enables you to make a meaningful contribution and positively impact the community in which we live.
We’re guided by five values in everything we do at HSS – in the way we work, how we make decisions and the way we behave:
We put our customers at the heart of what we do
We value and care for each other
We promise, we own, we do
We will find a way
We make a difference together
At HSS, we embrace diversity and believe that our best services come from a workplace where varied perspectives and experiences are welcomed and encouraged.
We are committed to creating an equitable and diverse workforce and encourage applications from people with disability, Aboriginal people, people from culturally diverse backgrounds, members of our LGBTQIA+ community, women, youth and mature age.
HSS is committed to growing our Aboriginal workforce as part of WA Health Aboriginal Workforce Policy. As a measure to achieve equality, Section 51 of the Equal Opportunity Act 1984 applies to this position and Aboriginal and Torres Strait Islander peoples are encouraged to apply.
WA Health engages staff in positions of trust and responsibility. WA Health policies require applicants to undertake a criminal records screening and integrity checking as part of the appointment process. As well as undertaking a criminal record screening and integrity checking, you may also be required to undertake a working with children check (if required for the role) and a pre-employment health assessment. We may ask referees to comment on your integrity and past demonstration of ethical behaviour. Please note that adverse information does not necessarily disqualify an applicant but will be considered as part of the appointment process.
Benefits of working with HSS
In addition to a competitive salary, we offer you a range of benefits, which may include (in line with operational requirements):
11.5% employer contributed superannuation into a fund of your choice.
Access to generous salary packaging arrangements
Professional development opportunities and study leave/assistance
Flexible working and leave arrangements
Discounts with our corporate partners
Health and well-being initiatives
Employee Assistance Program
Other professional and location-based allowances.
Want to know more?
Please contact Wilson Kwan, Lead Solution and Innovation Specialist, on 08 6373 3504 if you would like to discuss more about the role and team you’ll be working with.
Are you ready to apply?
To be successful with your application, you are required to:
Have a valid working visa (for fixed term appointments) or be an Australian citizen, permanent resident, or have a visa to live and work indefinitely in Australia (for permanent appointments).
Undertake a criminal record screening, working with children check (if required for the role), a pre-employment health assessment and integrity check, as part of the appointment process. We may ask referees to comment on your integrity and past demonstration of ethical behaviour.
Application and interview support
If you have any access needs that may require adjustments to allow you to fully participate in the application and interview process, please contact the HSS Work, Health and Safety team.
If you are an Aboriginal person who would like assistance with your application, please contact Jobs and Skills WA on 13 64 64.
How to apply
You’ve heard from us, now we’d like to hear from you.
Submit your application online by clicking the ‘Apply for Job’ button at the bottom of this page. You will need to provide:
a cover letter with no more than 2-3 pages that demonstrates you have the skills and experience we are looking for (as outlined in the JDF), with particular focus on the selection criteria (also outlined in the JDF);
a comprehensive CV that clearly shows your experience relevant to this role; and
the names and contact details of two professional referees. It is preferable for one of your referees to be your current supervisor or manager. 
Please allow plenty of time to submit your application, as late, emailed and proforma applications will not be accepted.
Submitting your application
Your application must be submitted online by Friday 18th July 2025. You must have a current, valid email address to apply online and this email address will be used by HSS to communicate with you.
If you experience difficulties while applying online, please contact HSS on 13 44 77 (select option 2 from the menu options) for immediate assistance during business hours.
As the submission is system generated, any submissions on, or after, 4:00pm cannot be accepted. 
Appointments from the pools will be made on a permanent, fixed term, full-time, part-time or casual basis.
Suitable applicants will be placed in a pool from which appointments may be made when similar vacancies occur.
Appointments may be made from this pool until 17/04/2026.
Thank you for considering a role with HSS.",,08 6373 3504,,HssHealthSupportServices_resume.pdf,HssHealthSupportServices_coverletter.pdf,,,
84875392,Data Engineer,Sense Recruitment,Perth WA,https://www.seek.com.au/job/84875392?type=standard&ref=search-standalone&origin=cardTitle#sol=e65fce960f840df1c7a51b2f4b4210f3564854a5,"Data Engineer | Make It Happen | Perth CBD (Mining & Logistics)
Not just a number. Not just a cog. This is your chance to shape how data drives a business.

This business is on a significant growth curve.  New mines, new buildings, mergers, expansion. And a heap of operational data from Safety, People and the Field that needs a tech brain to bring it together and make it work.
It’s not a polished corporate machine. It’s dynamic, hands-on, constantly evolving, and they like it that way. The approach is fast, practical, and proudly strappy - more startup than status quo.
  
We’re looking for a Data Engineer who gets things done. Someone who can bring structure to chaos, who’s not afraid to roll up their sleeves, and who’s excited by the chance to build something from the ground up. You'll be working side by side with a Data Analyst, supporting the business with fast, functional, value-driven solutions.
  
You’ll be #5 coming into this growing Tech Team. This is a small crew with big reach, and plenty of freedom to influence how things get done.
  
If you’re waiting for a detailed project brief and a 10-step plan, this probably isn’t for you. But if you’re a builder, a fixer, a tech-savvy doer who thrives on autonomy and variety, keep reading.
  
  
What You’ll Be Doing:
Build and maintain data pipelines across real time, IoT and monthly reporting environments
Build and maintain a scalable data warehouse to support analytics, real time reporting, business insights and interactive dashboards
Turn strategy into action using the tech that fits best (agile, tech agnostic, and focused on outcomes)
Partner with stakeholders in Operations, Safety and People teams to understand what’s needed and then deliver it
Take ownership in a small, close-knit team and wear a few different hats along the way
Bring order, speed and smart solutions to a business that’s moving quickly
  
You’ll Bring:
Strong SQL and Python skills, and experience with cloud platforms such as AWS or Azure
Familiarity with tools like AWS EMR, Glue, S3 and Kinesis
Ability to work independently, pivot when needed, and stay focused on outcomes
Energy, curiosity and a low ego, practical mindset
Bonus points for Operations Centre or IoT experience
  
What’s On Offer:
A genuinely autonomous role where your ideas are welcomed and your impact is visible
Freedom to design and build smart solutions that drive real business outcomes
A business that values simplicity, transparency and making a difference
You’ll be working in the Perth CBD office. This is a hands-on, on-site role where being close to the team and the tech makes all the difference
Occasional regional travel with the IT Manager
  
  
This is a newly created role. It’s not about maintaining what’s already built, it’s about building what’s needed.
If that sounds like you, we’d love to hear from you.",,,,MakeItHappen_resume.pdf,MakeItHappen_coverletter.pdf,,,
