job_id,title,company,location,url,description,email,phone,salary,resume_filename,coverletter_filename,Applied,Application Date,Questions
84905976,Senior Backend Developer,Brunel,Perth WA,https://www.seek.com.au/job/84905976?type=standard&ref=search-standalone&origin=cardTitle#sol=87c0dd06c6ced58848e08456ed3e120a2ce4373c,"Brunel are partnered with a leading resource company to deliver the best work opportunities for IT & Technical professionals within Australia. We are currently seeking Senior Back End Developer - to work on a contract basis on an exciting autonomy project. For further information about this position please apply.
Description
The Senior Backend Software Developer is a skilled individual contributor responsible for designing, implementing, and maintaining robust, scalable backend software. Working within a cross-functional squad and reporting to the Tech Lead, they collaborate closely with Domain experts and Architects to deliver high-quality software aligned with architectural direction and development standards.
This role supports the development of a next-generation fleet management and autonomy solution, enabling automated dispatch, high precision machine guidance, and control of autonomous vehicles. The systems they build form part of a complex distributed system across the data-center, control workstations and on-board hardware.
They are expected to lead by example in technical execution, mentor junior developers, and drive improvements in code quality, system performance, and maintainability.
Responsibilities
Design and implement backend services, APIs, and behaviours that meet functional and non-functional requirements.
Take responsibility of complex user stories and lead their technical execution from design to deployment.
Contribute to technical design reviews and provide feedback on system architecture in collaboration with Tech Leads and Architects.
Ensure code quality through peer reviews, automated testing, and documentation.
Contribute to codebase maintainability through refactoring, observability, and test coverage improvements.
Mentor developers within the squad, offering guidance on patterns, practices, and software design paradigms.
Collaborate with Domain Engineers to adopt and integrate shared frameworks and libraries.
Escalate technical risks or misalignments early to the Tech Lead.
Profile
Proven 5+ yearsʼ experience as a Software Developer or similar role.
Experience with the following technologies: C# .NET Core, Entity Framework, RabbitMQ
Experience with database technologies: SQL Server.
Experience with unit testing frameworks.
Experience with microservice architectures and containerisation using Docker or Kubernetes.
Familiarity with Linux systems.
Familiarity with Akka.net
Benefits:
Salary sacrifcing
Employee Assistance Program (EAP)
Corporate discounts
Job Offer
About Brunel:
Brunel is a recruitment and flexible workforce solution provider which connects talented people with opportunities throughout Australasia and around the world. We specialise in highly skilled roles across a variety of technical, professional, trades and craft disciplines, pairing candidates with industry-leading projects and organisations on a contract, permanent or secondment basis.
Operating in Australasia since 1997, Brunel has major bases of operation in Perth, Sydney, Brisbane and Port Moresby, which are further backed by the strength and reach of a truly global network spanning over 45 countries, 120 offices and 45 years of successful operation.
Brunel is proud to be equal opportunity employer and encourages applications from Aboriginal and Torres Strait Islander and female candidates.
How to apply:
If you meet the above requirements and would like to be considered for this role, please submit your interest using the 'Apply' button. Applying is quick and easy - just make sure you have the following documents ready to go:
Resume
Cover Letter (optional)
Do you have questions?
If you have any questions or would like to discuss the details of this role, please contact J.Bellinger-brown@brunel.net.",J.Bellinger-brown@brunel.net,,,Brunel_resume.pdf,Brunel_coverletter.pdf,,,
85060573,Principal Applications Developer (Pool),Department of Transport,Innaloo,https://www.seek.com.au/job/85060573?type=standard&ref=search-standalone&origin=cardTitle#sol=3b2551dfe26e7aee7d23800116e6df5322c31a8b,"Drive Change, Connect Communities 
Working for the Department of Transport (DoT) allows you to play a part in connecting the people of Western Australia. We are a progressive organisation. We are leaders in providing safe, accessible, sustainable, and efficient transport services and solutions that promote economic prosperity and enhance the lifestyles of all Western Australians.

The Opportunity
We are seeking a skilled and forward-thinking technical leader to drive our application development and support services.
As an experienced Principal Applications Developer, you will coordinate comprehensive system delivery services, overseeing the design, development, and maintenance of application programs that support the Department of Transport’s strategic objectives. You will play a key role in evaluating user requirements, advising on system enhancements, and ensuring applications are aligned with business needs and technological best practices. Your leadership will ensure our applications are robust, secure, and responsive to the evolving needs of the Department and the wider Transport Portfolio.
For further information about the role, we encourage you to review the attached Job Description Form (JDF) and contact Pansy Colkers, Manager Applications Delivery on (08) 6551 6566 or pansy.colkers@transport.wa.gov.au.
Suitable applicants will be placed in a pool from which appointments will be made for upcoming vacancies (fixed term or permanent) that arise within the next 12 months from date of first appointment across the Department of Transport. 

About you
Bring substantial experience in application development using Java/J2EE, AWS, and Angular within a large, complex environment.
Demonstrate strong leadership in coordinating system delivery and support services aligned with business needs.
Apply best-practice methodologies including Agile and quality control throughout the software development lifecycle.
Communicate effectively with diverse stakeholders and produce high-quality technical documentation.
Stay current with industry trends and foster collaboration to deliver reliable, secure, and efficient IT solutions.
 As part of our team, you will enjoy
A competitive salary, and 11.5% employer contributed superannuation and salary sacrifice options.
Generous leave entitlements including 4 weeks’ annual leave, 3 public service holidays yearly and long service leave every 7 years.
Salary packaging options to lease a new car.
Discounted gym memberships and health facilities.
A fabulous employee assistance program with a range of services and support channels
Bright, modern facility close to transport links with a friendly team environment.
Work for an innovative Government agency with limitless long-term career prospects.
Not just a job, but an opportunity to develop your career across other areas of transport.
In addition to rewarding work, we invite you to be Part of Something Real. Learn more about our commitment to you, here.
 Apply Now!
Apply online by clicking the ‘Apply’ button where you will be redirected to the JobsWA vacancy for this pool. There, you will find comprehensive details about the position, including the Job Description Form (JDF), other positions on offer and instructions on the application requirements and how to apply.
Applications for this opportunity close at 3pm on Friday, 11 July 2025. Please ensure your application is submitted on time, as late applications will not be accepted. 
The DoT may conduct further search activities or extend the closing date, if required to supplement the field of applicants. 

Our commitment to a diverse and inclusive workplace
The Department of Transport is committed to building a thriving workforce that reflects the diversity of our customers and our community. We encourage applications from every background, including Aboriginal and Torres Strait Islander people, people with disability, women, youth, members of the LGBTQIA+ community, and people from culturally and linguistically diverse backgrounds. 
If you have any support or access needs that may require adjustments to allow you to fully participate in this selection process (including an alternate format of the application form), have any question about the process or how to submit your application, please contact our Recruitment Team at recruitment@transport.wa.gov.au or (08) 6551 6888.",pansy.colkers@transport.wa.gov.au,,,DepartmentOfTransportDot_resume.pdf,DepartmentOfTransportDot_coverletter.pdf,,,
84620759,Developer,Indigeco Pty Ltd,Perth WA,https://www.seek.com.au/job/84620759?type=standard&ref=search-standalone&origin=cardTitle#sol=39dfb850ef0633f43a932bb6417929af8af1e9e0,"Job Title: Specialist Software Engineer
Location: Perth, WA
Rate: $850–$900 + Super per day
6 months contract

About the Role

We are seeking a Specialist Software Engineer to join a dynamic Agile team developing a mining digital twin. This exciting Perth-based contract role will see you solving real-world challenges across drill and blast automation, fleet optimisation, and material movement modelling.
You’ll design, develop, and deliver scalable software solutions using modern development practices and tools. You’ll also collaborate with cross-functional teams, contribute to architectural decisions, and play an integral part in shaping innovative mining technology.

Skills & Experience Essential:
Bachelor’s degree in IT, Computer Science, or related field
3–5+ years’ experience in professional software development
Proficiency in Python, Azure Functions, and .NET Core
Experience with containerisation (Docker, Kubernetes)
Strong understanding of CI/CD, Trunk-based development, and Azure DevOps
Experience building RESTful APIs and working with message busses
Solid experience in TDD (Test-Driven Development) and unit testing
Skills in database development (SQL, NoSQL)
Version control expertise using Git
Excellent understanding of software design principles and architecture
Strong communication and teamwork in Agile environments
Front-end development experience using React, JavaScript, TypeScript

Apply today to work on innovative mining solutions with a collaborative, forward-thinking engineering team.",,,$850,NotProvided_resume.pdf,NotProvided_coverletter.pdf,,,
85060578,Senior Applications Developer (Pool),Department of Transport,Innaloo,https://www.seek.com.au/job/85060578?type=standard&ref=search-standalone&origin=cardTitle#sol=758def859b4f9c5e6503da2c24077f9a1e8aade1,"Drive Change, Connect Communities 
Working for the Department of Transport (DoT) allows you to play a part in connecting the people of Western Australia. We are a progressive organisation. We are leaders in providing safe, accessible, sustainable, and efficient transport services and solutions that promote economic prosperity and enhance the lifestyles of all Western Australians.

The Opportunity
We are seeking a technically skilled and collaborative professional to support the development and maintenance of our business systems.
As an experienced Senior Applications Developer, you will play a key role in delivering and supporting software applications that underpin the Department of Transport’s operations. You will coordinate system development activities, provide expert advice on application environments, and ensure solutions are aligned with business needs and departmental standards. Your ability to work autonomously and collaboratively will be essential in driving innovation and maintaining the reliability and effectiveness of our IT systems.
For further information about the role, we encourage you to review the attached Job Description Form (JDF) and contact Pansy Colkers, Manager Applications Delivery on (08) 6551 6566 or pansy.colkers@transport.wa.gov.au.
Suitable applicants will be placed in a pool from which appointments will be made for upcoming vacancies (fixed term or permanent) that arise within the next 12 months from date of first appointment across the Department of Transport. 

About you
Bring considerable experience in developing and supporting software applications within a large, complex environment.
Demonstrate strong technical proficiency in Java/J2EE, AWS, Angular, and Agile/Scrum methodologies.
Apply well-developed analytical and problem-solving skills to deliver effective, user-focused solutions.
Communicate clearly and confidently with stakeholders, providing expert advice and support.
Work autonomously and collaboratively within multidisciplinary teams to achieve high-quality outcomes.

As part of our team, you will enjoy
A competitive salary, and 11.5% employer contributed superannuation and salary sacrifice options.
Generous leave entitlements including 4 weeks’ annual leave, 3 public service holidays yearly and long service leave every 7 years.
Salary packaging options to lease a new car.
Discounted gym memberships and health facilities.
A fabulous employee assistance program with a range of services and support channels
Bright, modern facility close to transport links with a friendly team environment.
Work for an innovative Government agency with limitless long-term career prospects.
Not just a job, but an opportunity to develop your career across other areas of transport.
In addition to rewarding work, we invite you to be Part of Something Real. Learn more about our commitment to you, here.
 Apply Now!
Apply online by clicking the ‘Apply’ button where you will be redirected to the JobsWA vacancy for this pool. There, you will find comprehensive details about the position, including the Job Description Form (JDF), other positions on offer and instructions on the application requirements and how to apply.
Applications for this opportunity close at 3pm on Friday, 11 June 2025. Please ensure your application is submitted on time, as late applications will not be accepted. 
The DoT may conduct further search activities or extend the closing date, if required to supplement the field of applicants. 

Our commitment to a diverse and inclusive workplace
The Department of Transport is committed to building a thriving workforce that reflects the diversity of our customers and our community. We encourage applications from every background, including Aboriginal and Torres Strait Islander people, people with disability, women, youth, members of the LGBTQIA+ community, and people from culturally and linguistically diverse backgrounds. 
If you have any support or access needs that may require adjustments to allow you to fully participate in this selection process (including an alternate format of the application form), have any question about the process or how to submit your application, please contact our Recruitment Team at recruitment@transport.wa.gov.au or (08) 6551 6888.",pansy.colkers@transport.wa.gov.au,,,DepartmentOfTransportDot_resume.pdf,DepartmentOfTransportDot_coverletter.pdf,,,
84927415,Capgemini Winter Internship,GradConnection,Perth WA,https://www.seek.com.au/job/84927415?type=standard&ref=search-standalone&origin=cardTitle#sol=64b02798ff5455a0db944366dde3b83a8c651b2f,"2025 Capgemini Winter Internship
This winter we will run an internship for 8 - 9 Weeks where you will have the opportunity to discover what it’s like to learn and work with the amazing team at Capgemini. We have demand arising throughout the year – so we will also provide internship opportunities in the Summer break, which we will advertise separately
 
From day one you will have the opportunity to work on exciting projects with our clients  and gain insights into the consulting industry. We will provide you with practical consultign experience to  compliment your studies and help to set you up for career success.
Our program provides you with:
Insights into Capgemini’s culture.
An opportunity to work with and learn from current staff
Valuable on the job work experience
Practical experience to build on your theoretical knowledge
Opportunities to develop your skills through one-on-one coaching and mentoring
The chance to undertake challenging client work and engagements with potentially broad social impacts
The platform to expand your professional network with a globally respected organisation
Let's talk about our team:
We are over 350,000 people passionate about helping our clients solve their most complex business and technology challenges, and we deliver transformational outcomes, at scale. We are driven by the conviction that the business value of technology comes from and through people. 
Let's talk about what we do:
At Capgemini, we help the world's leading brands use the best of new tech to transform the way they do business. As a global leader in consulting, technology services, and digital transformation, Capgemini is at the forefront of innovation to address the entire breadth of clients' opportunities in the evolving world of cloud, digital and platforms.
Our graduates typically work in roles in the areas of Software Development, DevOps, Change Management, Business Analysis and Program Management Office. One of our available internships is also looking for a innovation extraordinaire with a flair for AI and a finger on the pulse of the latest and greatest technology innovations 
Let’s talk about what you will need to be considered for our program:
You must attach a cover letter and resume.
You will need to meet the following requirements:
Be in your second (penultimate year) or last year of an undergraduate or postgraduate degree
Exceptional communication skills and an outstanding customer service ethic
Great academic results as well as a passion for solving complex problems
And finally, individuals who care about our people, our community, and our planet and who are totally aligned to our values.
As ""Architects of Positive Futures"", Capgemini actively supports the community in 3 ways:
We believe that every one of us is an architect of positive futures. We invite you to join us to discover a career that will challenge, support and inspire you. With a world class Learning and Development program for graduates and all employees, we will set you up for success.
As Australian Workplace Equality Indexes' Top Employer 2023, we are proud of our inclusion efforts for the LGBTQ+ community and beyond, to ensure everyone belongs at Capgemini. We are proud to be ranked among Ethisphere's 2020 Most Ethical Companies in the World (for the 10th year running!), and as a global company, we have climate change at the heart of our priorities, with a focal point of our ambitions target of net zero carbon emissions by 2030.
Our seven values are at the heart of everything we do - Honesty, Boldness, Trust, Team Spirit, Freedom, Fun and Modesty. As Social Innovators, we are committed to making a positive impact on the planet and our communities. Capgemini is proud to be an Equal Opportunity Employer.
Successful applicants will be required to complete police checks prior to commencement of employment.
Please make sure to let us know your visa status. Please list whether you are a Citizen, Permanent resident, 485 working Visa holder or other. If you are Other, please clarify which visa you currently hold (please also list the number e.g 820 Temporary Partner Visa).",,,,Capgemini_resume.pdf,Capgemini_coverletter.pdf,,,
84836334,Software Packaging Administrator,Data#3 People Solutions,Perth WA,https://www.seek.com.au/job/84836334?type=standard&ref=search-standalone&origin=cardTitle#sol=9f16794c97ef14acf39325cb58461cec4bdeb82c,"About the Role
We are seeking an experienced Software Packaging Administrator to join a leading IT environment in Perth on a 6-month contract. In this role, you'll be responsible for building, testing, and maintaining software packages to ensure efficient and seamless deployment across the organization.
You’ll collaborate with technical teams to deliver high-quality application packages, troubleshoot deployment issues, and maintain clear documentation throughout the process.
Key Responsibilities
Develop and maintain software packages using tools like SCCM, InstallShield, MSI, and App-V
Test packages in multiple environments to ensure functionality and compatibility
Work closely with IT teams to manage deployments and resolve deployment-related issues
Provide technical support for application packaging and distribution
Maintain thorough documentation and follow best practice standards
What We’re Looking For
Experience in software packaging and deployment
Proficiency in SCCM, InstallShield, and scripting tools (e.g., PowerShell, VBScript, or Python)
Strong knowledge of Windows and Mac operating systems
Excellent troubleshooting and problem-solving skills
Strong communication and ability to work in cross-functional teams
Desirable Skills
Experience with cloud-based deployment tools
Relevant certifications (e.g., Microsoft Modern Desktop Administrator)
Familiarity with ITIL practices
 Please submit your resume via the Apply button. To find out more, please email Shams at shams_shiraz@data3.com.au or call on 0422 2400 69",shams_shiraz@data3.com.au,,,ConfidentialCompanyNameNotProvidedInJobDescription_resume.pdf,ConfidentialCompanyNameNotProvidedInJobDescription_coverletter.pdf,,,
84676582,System Developer,Ear Science Institute Australia,Subiaco,https://www.seek.com.au/job/84676582?type=standard&ref=search-standalone&origin=cardTitle#sol=1017d58ff0819d48f6c43519a81b986f47225703,"About us:
At Ear Science Institute Australia, we are on a mission to transform the lives of people with ear and hearing disorders through world class research, clinical care, and innovation. We are seeking a skilled Systems Developer to join our team and play a pivotal role in enhancing and maintaining our ERP platform, NetSuite, and ensure the seamless integration of related third-party applications.  
About the role:
As part of our ICT team, you will play a key role in supporting the design, development and ongoing maintenance of our ERP platform and integrated systems. You will collaborate with stakeholders across the organisation to drive efficiency, troubleshoot issues and develop tailored solutions that align with our business needs.
Key Responsibilities:
Collaborate and partner with internal stakeholders to understand business requirements and translate them into ERP functionality;
Develop and maintain configurations, customisations, and custom scripts using SuiteScript v 1.0 and v 2.1 in NetSuite to meet the organisation's business requirements;
Integrate multiple software products and implement REST-based and other APIs;
Implement and maintain OAuth2 and JWT’s;
Work with data migration to ensure data integrity;
Troubleshoot and debug issues in existing customisations;
Collaborate with stakeholders to identify areas of improvement in the system;
Support ongoing system integration of corporate applications and process automation development;
Support end-user requests for new reports, dashboards, roles, and permissions;
Maintain and support the NetSuite ERP applications and related 3rd party integrations for internal stakeholders.
About you:
You are a technically proficient Systems Developer who thrives in a collaborative environment and is passionate about delivering high-quality digital solutions.
To be successful in the role you will have:
A Bachelor’s Degree in Computer Science / Information Technology;
Strong knowledge and understanding of JavaScript (preferably including Angular, React and Node), C# HTML, CSS;
Strong understanding of databases, particularly MSSQL;
Experience with NetSuite administration and/or implementation;
Experience working with, understanding and resolving issues in existing customisations;
Experience with REST-based and other APIs;
Knowledge and experience implementing RESTlets;
Experience with OAuth2 and JWT’s;
Excellent communication skills and the ability to work with diverse stakeholders;
Experience with data migration;
Proficiency in integrating with multiple software products;
Experience with Microsoft 365 and SharePoint.
What we offer:
An attractive remuneration with greater take home pay through salary sacrifice;
Access to our Corporate Discount Program;
A comprehensive employee wellbeing program, including 2 days of wellness leave per year, discounted gym membership and access to informative webinars;
Free professional counselling for you and your family via our Employee Assistance Program;
Birthday Leave – enjoy a day off to celebrate your special day!
Access to discounted private health cover;
The opportunity to be part of an organisation committed to excellence and innovation whilst making a positive impact in the community.
How to Apply:
Please click 'Apply for this Job' and submit the following:
A cover letter
Your most recent resume (CV)
For any enquiries, please contact us at human.resources@earscience.org.au
Ear Science Institute Australia values workplace diversity, promotes inclusion. We strongly encourage Aboriginal and Torres Strait Islanders, women, and individuals with a disability to apply. 
Ear Science reserves the right to withdraw this advertisement at any time.",human.resources@earscience.org.au,,,EarScienceInstituteAustralia_resume.pdf,EarScienceInstituteAustralia_coverletter.pdf,,,
